{"algorithm":"place-registry-v1","algorithm_config_version":"0000000000000000","approval_state":"proposed","effective_from":"2026-01-01T00:00:00Z","effective_until":null,"latitude":0.0,"longitude":0.0,"place_id":"plc_00000000000000000000000000000000","privacy_class":"restricted","processed_at":"2026-01-01T00:00:01Z","radius_m":1.0,"schema_version":"1","sensitivity":"restricted","source_digest":"0000000000000000000000000000000000000000000000000000000000000000","subject_id":"sub_00000000","version":1}
